<?xml version="1.0" encoding="UTF-8"?>
<xs:schema xmlns:xs="http://www.w3.org/2001/XMLSchema">
<xs:element name="Boerse">
	<xs:complexType>
		<xs:sequence>	
			<xs:element name="BoersenEintrag" minOccurs="1" maxOccurs="unbounded">
				<xs:complexType>
					<xs:sequence>
						<xs:element name="BoerseneintragsID" type="xs:int" maxOccurs="1" minOccurs="1"/>	
						<xs:element ref="Person"/>
					 	<xs:element name="Erstellungsdatum" type="xs:dateTime" />
						<xs:element name="Titel" type="xs:string" />
						<xs:element name="Informationstext" type="xs:string" />
						<xs:element name="Startdatum" type="xs:dateTime" />
						<xs:element name="Ablaufdatum" type="xs:dateTime" />
						<xs:element name="Kommentare" minOccurs="0" maxOccurs="unbounded">
						<xs:complexType>
							<xs:sequence>
								<xs:element name="KommentarID" type="xs:int"  maxOccurs="1" minOccurs="1"/>
								<xs:element ref="Person"/>
								<xs:element name="Datum" type="xs:dateTime" />
								<xs:element name="Informationstext" type="xs:string" />
							</xs:sequence>
						</xs:complexType>
					</xs:element>
					<xs:element name="Typ">
					 	<xs:simpleType>
					    	<xs:restriction base="xs:string">
					      		<xs:enumeration value="Angebot" />
					      		<xs:enumeration value="Gesuch" />
					   		</xs:restriction>
					  	</xs:simpleType>
					</xs:element>
				</xs:sequence>
			</xs:complexType>
		</xs:element>
 </xs:sequence>
	</xs:complexType>
</xs:element>

<!-- Definitionen -->		
	<xs:element name="Person">
	<xs:complexType>
		<xs:sequence>
		<xs:element name="Person_ID" type="xs:int" minOccurs="1" maxOccurs="1"/>
			<xs:element name="Typ">
	 			<xs:simpleType>
			    	<xs:restriction base="xs:string">
			      		<xs:enumeration value="Gastronom" />
			      		<xs:enumeration value="Lieferant" />
			   		</xs:restriction>
	  			</xs:simpleType>
	  		</xs:element>
			<xs:element name="Vorname" type="xs:string"/>
			<xs:element name="Nachname" type="xs:string"/>
			<!-- Gastronom muss über 18 sein um Käufe abzuwickeln -->
			<xs:element name="Alter">
				<xs:simpleType>
					<xs:restriction base="xs:int">
						<xs:minInclusive value="18" />
						<xs:maxInclusive value="100" />
					</xs:restriction>
				</xs:simpleType>
			</xs:element>
			<xs:element ref="Betrieb"/>
		</xs:sequence>
	</xs:complexType>
</xs:element>
			
<xs:element name="Betrieb">
	<xs:complexType>
		<xs:sequence>
			<xs:element name="Betriebs_ID" type="xs:int" minOccurs="1" maxOccurs="1"/>
			<xs:element name="Betriebname" type="xs:string" minOccurs="1" maxOccurs="1" />
			<xs:element name="Adresse">
				<xs:complexType>
					<xs:sequence>
						<xs:element name="strasse" type="xs:string"/>
						<xs:element name="Hausnummer" type="xs:int"/>
						<xs:element name="PLZ">
							<xs:simpleType>
								<xs:restriction base="xs:int">
									<xs:pattern value="(D )?[0-9]{5}" />
								</xs:restriction>
							</xs:simpleType>
						</xs:element>
					</xs:sequence>
				</xs:complexType>
			</xs:element>
			<xs:element name="Art_des_Betriebes" type="xs:string" />
		</xs:sequence>
	</xs:complexType>
</xs:element>
</xs:schema>