<?xml version="1.0" encoding="UTF-8"?>
<Boerse xmlns:xsi="http://www.w3.org/2001/XMLSchema-instance" xsi:noNamespaceSchemaLocation="Boerse.xsd">
  <Eintrag>
    <Person>
      <Typ>Gastronom</Typ>
      <Vorname/>
      <Nachname/>
      <Alter>0</Alter>
      <Betrieb>
        <Betriebname/>
        <Adresse>
          <Straße/>
          <PLZ>0</PLZ>
        </Adresse>
        <Art_des_Betriebes>Art_des_Betriebes</Art_des_Betriebes>
      </Betrieb>
    </Person>
    <Erstellungsdatum>2001-12-31T12:00:00</Erstellungsdatum>
    <Titel>Titel</Titel>
    <Informationstext>Informationstext</Informationstext>
    <Startdatum>2001-12-31T12:00:00</Startdatum>
    <Ablaufdatum>2001-12-31T12:00:00</Ablaufdatum>
    <Kommentare>
      <Person>
        <Typ>Gastronom</Typ>
        <Vorname/>
        <Nachname/>
        <Alter>0</Alter>
        <Betrieb>
          <Betriebname/>
          <Adresse>
            <Straße/>
            <PLZ>0</PLZ>
          </Adresse>
          <Art_des_Betriebes>Art_des_Betriebes</Art_des_Betriebes>
        </Betrieb>
      </Person>
      <Datum>2001-12-31T12:00:00</Datum>
      <Informationstext>Informationstext</Informationstext>
    </Kommentare>
    <Typ>Angebot</Typ>
  </Eintrag>
</Boerse>
